<?xml version="1.0" encoding="UTF-8"?>
<!DOCTYPE locations SYSTEM "locations.dtd">
<locations>
	<location>
		<location_id></location_id>
		<location_name></location_name>
		<location_code></location_code>
		<is_auction></is_auction>
		<customer_id></customer_id>
		<address_street1></address_street1>
		<address_street2></address_street2>
		<city></city>
		<state></state>
		<postal_code></postal_code>
		<region></region>
		<location_contact_name></location_contact_name>
		<location_phone></location_phone>
		<location_fax_number></location_fax_number>
		<location_email></location_email>
	</location>
</locations>